{"EOTF": [1, "/categories/eotf/", {"posts": [{"date": "12/05/2015", "isodate": "2015-12-05T00:17:30+00:00", "title": "The Importance of Terminology and sRGB Uncertainty", "url": "/posts/the-importance-of-terminology-and-srgb-uncertainty/"}]}], "OETF": [1, "/categories/oetf/", {"posts": [{"date": "12/05/2015", "isodate": "2015-12-05T00:17:30+00:00", "title": "The Importance of Terminology and sRGB Uncertainty", "url": "/posts/the-importance-of-terminology-and-srgb-uncertainty/"}]}], "Pointer's gamut": [1, "/categories/pointers-gamut/", {"posts": [{"date": "10/01/2014", "isodate": "2014-10-01T03:55:00-13:00", "title": "A Plea for Colour Analysis Tools in DCC Applications", "url": "/posts/a-plea-for-colour-analysis-tools-in-dcc-applications/"}]}], "RED": [1, "/categories/red/", {"posts": [{"date": "04/29/2015", "isodate": "2015-04-29T10:12:00-12:00", "title": "RED Colourspaces Derivation", "url": "/posts/red-colourspaces-derivation/"}]}], "RGB colourspace": [5, "/categories/rgb-colourspace/", {"posts": [{"date": "12/05/2015", "isodate": "2015-12-05T00:17:30+00:00", "title": "The Importance of Terminology and sRGB Uncertainty", "url": "/posts/the-importance-of-terminology-and-srgb-uncertainty/"}, {"date": "04/29/2015", "isodate": "2015-04-29T10:12:00-12:00", "title": "RED Colourspaces Derivation", "url": "/posts/red-colourspaces-derivation/"}, {"date": "10/09/2014", "isodate": "2014-10-09T03:38:00-13:00", "title": "About RGB Colourspace Models Performance", "url": "/posts/about-rgb-colourspace-models-performance/"}, {"date": "10/01/2014", "isodate": "2014-10-01T03:55:00-13:00", "title": "A Plea for Colour Analysis Tools in DCC Applications", "url": "/posts/a-plea-for-colour-analysis-tools-in-dcc-applications/"}, {"date": "09/17/2014", "isodate": "2014-09-17T13:25:00-12:00", "title": "About Rendering Engines Colourspaces Agnosticism", "url": "/posts/about-rendering-engines-colourspaces-agnosticism/"}]}], "aces": [1, "/categories/aces/", {"posts": [{"date": "03/12/2017", "isodate": "2017-03-12T05:29:15+00:00", "title": "Colour 0.3.9, Colour - HDRI 0.1.2 and ACES!", "url": "/posts/colour-039-colour-hdri-012-aces/"}]}], "anaconda": [1, "/categories/anaconda/", {"posts": [{"date": "09/06/2014", "isodate": "2014-09-06T02:45:00-12:00", "title": "PyCharm, Vagrant, Fabric & Anaconda", "url": "/posts/pycharm-vagrant-fabric-anaconda/"}]}], "chromaticity diagram": [5, "/categories/chromaticity-diagram/", {"posts": [{"date": "12/05/2015", "isodate": "2015-12-05T00:17:30+00:00", "title": "The Importance of Terminology and sRGB Uncertainty", "url": "/posts/the-importance-of-terminology-and-srgb-uncertainty/"}, {"date": "04/29/2015", "isodate": "2015-04-29T10:12:00-12:00", "title": "RED Colourspaces Derivation", "url": "/posts/red-colourspaces-derivation/"}, {"date": "10/09/2014", "isodate": "2014-10-09T03:38:00-13:00", "title": "About RGB Colourspace Models Performance", "url": "/posts/about-rgb-colourspace-models-performance/"}, {"date": "10/01/2014", "isodate": "2014-10-01T03:55:00-13:00", "title": "A Plea for Colour Analysis Tools in DCC Applications", "url": "/posts/a-plea-for-colour-analysis-tools-in-dcc-applications/"}, {"date": "09/17/2014", "isodate": "2014-09-17T13:25:00-12:00", "title": "About Rendering Engines Colourspaces Agnosticism", "url": "/posts/about-rendering-engines-colourspaces-agnosticism/"}]}], "colour": [9, "/categories/colour/", {"posts": [{"date": "08/09/2017", "isodate": "2017-08-09T03:23:09+01:00", "title": "The Road to Stable", "url": "/posts/the-road-to-stable/"}, {"date": "07/12/2017", "isodate": "2017-07-12T10:47:36+01:00", "title": "Colour 0.3.10 is available!", "url": "/posts/colour-0310-is-available/"}, {"date": "03/12/2017", "isodate": "2017-03-12T05:29:15+00:00", "title": "Colour 0.3.9, Colour - HDRI 0.1.2 and ACES!", "url": "/posts/colour-039-colour-hdri-012-aces/"}, {"date": "12/13/2015", "isodate": "2015-12-13T06:14:07+00:00", "title": "Colour 0.3.7 is available!", "url": "/posts/colour-037-is-available/"}, {"date": "08/09/2015", "isodate": "2015-08-09T22:31:00-12:00", "title": "Colour 0.3.6 is available!", "url": "/posts/colour-036-is-available/"}, {"date": "05/07/2015", "isodate": "2015-05-07T01:01:00-12:00", "title": "Colour 0.3.5 is available!", "url": "/posts/colour-035-is-available/"}, {"date": "01/28/2015", "isodate": "2015-01-28T02:50:00-13:00", "title": "Colour 0.3.4 is available!", "url": "/posts/colour-034-is-available/"}, {"date": "10/29/2014", "isodate": "2014-10-29T07:44:00-13:00", "title": "Colour 0.3.3 is available!", "url": "/posts/colour-033-is-available/"}, {"date": "09/02/2014", "isodate": "2014-09-02T04:27:00-12:00", "title": "The first public release of Colour is available!", "url": "/posts/the-first-public-release-of-colour-is-available/"}]}], "colour-demosaicing": [1, "/categories/colour-demosaicing/", {"posts": [{"date": "12/18/2015", "isodate": "2015-12-18T06:15:31+00:00", "title": "Demosaicing and High Dynamic Range Imaging with Python", "url": "/posts/demosaicing-and-hdri-with-python/"}]}], "colour-hdri": [2, "/categories/colour-hdri/", {"posts": [{"date": "03/12/2017", "isodate": "2017-03-12T05:29:15+00:00", "title": "Colour 0.3.9, Colour - HDRI 0.1.2 and ACES!", "url": "/posts/colour-039-colour-hdri-012-aces/"}, {"date": "12/18/2015", "isodate": "2015-12-18T06:15:31+00:00", "title": "Demosaicing and High Dynamic Range Imaging with Python", "url": "/posts/demosaicing-and-hdri-with-python/"}]}], "colour-science.org": [1, "/categories/colour-scienceorg/", {"posts": [{"date": "12/04/2015", "isodate": "2015-12-04T08:25:28+00:00", "title": "A New Logo and Website!", "url": "/posts/a-new-logo-and-website/"}]}], "fabric": [1, "/categories/fabric/", {"posts": [{"date": "09/06/2014", "isodate": "2014-09-06T02:45:00-12:00", "title": "PyCharm, Vagrant, Fabric & Anaconda", "url": "/posts/pycharm-vagrant-fabric-anaconda/"}]}], "pycharm": [1, "/categories/pycharm/", {"posts": [{"date": "09/06/2014", "isodate": "2014-09-06T02:45:00-12:00", "title": "PyCharm, Vagrant, Fabric & Anaconda", "url": "/posts/pycharm-vagrant-fabric-anaconda/"}]}], "reflectance": [1, "/categories/reflectance/", {"posts": [{"date": "09/19/2014", "isodate": "2014-09-19T09:34:00-12:00", "title": "About Reflectance Recovery - Smits (1999) Method", "url": "/posts/about-reflectance-recovery/"}]}], "release": [10, "/categories/release/", {"posts": [{"date": "07/12/2017", "isodate": "2017-07-12T10:47:36+01:00", "title": "Colour 0.3.10 is available!", "url": "/posts/colour-0310-is-available/"}, {"date": "03/12/2017", "isodate": "2017-03-12T05:29:15+00:00", "title": "Colour 0.3.9, Colour - HDRI 0.1.2 and ACES!", "url": "/posts/colour-039-colour-hdri-012-aces/"}, {"date": "12/18/2015", "isodate": "2015-12-18T06:15:31+00:00", "title": "Demosaicing and High Dynamic Range Imaging with Python", "url": "/posts/demosaicing-and-hdri-with-python/"}, {"date": "12/13/2015", "isodate": "2015-12-13T06:14:07+00:00", "title": "Colour 0.3.7 is available!", "url": "/posts/colour-037-is-available/"}, {"date": "12/04/2015", "isodate": "2015-12-04T08:25:28+00:00", "title": "A New Logo and Website!", "url": "/posts/a-new-logo-and-website/"}, {"date": "08/09/2015", "isodate": "2015-08-09T22:31:00-12:00", "title": "Colour 0.3.6 is available!", "url": "/posts/colour-036-is-available/"}, {"date": "05/07/2015", "isodate": "2015-05-07T01:01:00-12:00", "title": "Colour 0.3.5 is available!", "url": "/posts/colour-035-is-available/"}, {"date": "01/28/2015", "isodate": "2015-01-28T02:50:00-13:00", "title": "Colour 0.3.4 is available!", "url": "/posts/colour-034-is-available/"}, {"date": "10/29/2014", "isodate": "2014-10-29T07:44:00-13:00", "title": "Colour 0.3.3 is available!", "url": "/posts/colour-033-is-available/"}, {"date": "09/02/2014", "isodate": "2014-09-02T04:27:00-12:00", "title": "The first public release of Colour is available!", "url": "/posts/the-first-public-release-of-colour-is-available/"}]}], "sRGB": [1, "/categories/srgb/", {"posts": [{"date": "12/05/2015", "isodate": "2015-12-05T00:17:30+00:00", "title": "The Importance of Terminology and sRGB Uncertainty", "url": "/posts/the-importance-of-terminology-and-srgb-uncertainty/"}]}], "spectral": [4, "/categories/spectral/", {"posts": [{"date": "10/09/2014", "isodate": "2014-10-09T03:38:00-13:00", "title": "About RGB Colourspace Models Performance", "url": "/posts/about-rgb-colourspace-models-performance/"}, {"date": "10/01/2014", "isodate": "2014-10-01T03:55:00-13:00", "title": "A Plea for Colour Analysis Tools in DCC Applications", "url": "/posts/a-plea-for-colour-analysis-tools-in-dcc-applications/"}, {"date": "09/19/2014", "isodate": "2014-09-19T09:34:00-12:00", "title": "About Reflectance Recovery - Smits (1999) Method", "url": "/posts/about-reflectance-recovery/"}, {"date": "09/17/2014", "isodate": "2014-09-17T13:25:00-12:00", "title": "About Rendering Engines Colourspaces Agnosticism", "url": "/posts/about-rendering-engines-colourspaces-agnosticism/"}]}], "transfer": [1, "/categories/transfer/", {"posts": [{"date": "12/05/2015", "isodate": "2015-12-05T00:17:30+00:00", "title": "The Importance of Terminology and sRGB Uncertainty", "url": "/posts/the-importance-of-terminology-and-srgb-uncertainty/"}]}], "vagrant": [1, "/categories/vagrant/", {"posts": [{"date": "09/06/2014", "isodate": "2014-09-06T02:45:00-12:00", "title": "PyCharm, Vagrant, Fabric & Anaconda", "url": "/posts/pycharm-vagrant-fabric-anaconda/"}]}]}